{
  "contract_status": "proposed",
  "coordinate_type": "image_pixel",
  "data_source": "synthetic",
  "error": null,
  "experimental": true,
  "image_type": "calibration",
  "matching": {
    "id_scope": "image_local",
    "owner_status": "unassigned",
    "physical_identity_guaranteed": false,
    "status": "not_performed"
  },
  "metrology_validated": false,
  "module": "m2_image_recognition",
  "quality": {
    "background_intensity_8bit": 0.0,
    "count_policy": "range",
    "detected_count": 94,
    "detection_threshold_8bit": 28.0,
    "is_usable": true,
    "max_count": 150,
    "min_count": 12,
    "minimum_usable_confidence": 0.35,
    "raw_candidate_count": 94,
    "rejected_area_count": 0,
    "rejected_border_count": 0,
    "warnings": []
  },
  "schema_version": "m2.multispot.experimental.1",
  "spots": [
    {
      "area_pixel2": 401.0,
      "confidence": 0.8889867841409691,
      "detection_id": 0,
      "integrated_residual_8bit_pixel": 24803.0,
      "mean_intensity_8bit": 110.2793017456359,
      "peak_intensity_8bit": 222.0,
      "peak_residual_intensity_8bit": 171.0,
      "quality_flags": [],
      "x": 325.0,
      "y": 107.0
    },
    {
      "area_pixel2": 401.0,
      "confidence": 0.8889867841409691,
      "detection_id": 1,
      "integrated_residual_8bit_pixel": 24803.0,
      "mean_intensity_8bit": 110.2793017456359,
      "peak_intensity_8bit": 222.0,
      "peak_residual_intensity_8bit": 171.0,
      "quality_flags": [],
      "x": 415.0,
      "y": 107.0
    },
    {
      "area_pixel2": 401.0,
      "confidence": 0.8889867841409691,
      "detection_id": 2,
      "integrated_residual_8bit_pixel": 24803.0,
      "mean_intensity_8bit": 110.2793017456359,
      "peak_intensity_8bit": 222.0,
      "peak_residual_intensity_8bit": 171.0,
      "quality_flags": [],
      "x": 505.0,
      "y": 107.0
    },
    {
      "area_pixel2": 401.0,
      "confidence": 0.8889867841409691,
      "detection_id": 3,
      "integrated_residual_8bit_pixel": 24803.0,
      "mean_intensity_8bit": 110.2793017456359,
      "peak_intensity_8bit": 222.0,
      "peak_residual_intensity_8bit": 171.0,
      "quality_flags": [],
      "x": 595.0,
      "y": 107.0
    },
    {
      "area_pixel2": 401.0,
      "confidence": 0.8889867841409691,
      "detection_id": 4,
      "integrated_residual_8bit_pixel": 24803.0,
      "mean_intensity_8bit": 110.2793017456359,
      "peak_intensity_8bit": 222.0,
      "peak_residual_intensity_8bit": 171.0,
      "quality_flags": [],
      "x": 685.0,
      "y": 107.0
    },
    {
      "area_pixel2": 401.0,
      "confidence": 0.8889867841409691,
      "detection_id": 5,
      "integrated_residual_8bit_pixel": 24803.0,
      "mean_intensity_8bit": 110.2793017456359,
      "peak_intensity_8bit": 222.0,
      "peak_residual_intensity_8bit": 171.0,
      "quality_flags": [],
      "x": 775.0,
      "y": 107.0
    },
    {
      "area_pixel2": 401.0,
      "confidence": 0.8889867841409691,
      "detection_id": 6,
      "integrated_residual_8bit_pixel": 24803.0,
      "mean_intensity_8bit": 110.2793017456359,
      "peak_intensity_8bit": 222.0,
      "peak_residual_intensity_8bit": 171.0,
      "quality_flags": [],
      "x": 865.0,
      "y": 107.0
    },
    {
      "area_pixel2": 401.0,
      "confidence": 0.8889867841409691,
      "detection_id": 7,
      "integrated_residual_8bit_pixel": 24803.0,
      "mean_intensity_8bit": 110.2793017456359,
      "peak_intensity_8bit": 222.0,
      "peak_residual_intensity_8bit": 171.0,
      "quality_flags": [],
      "x": 955.0,
      "y": 107.0
    },
    {
      "area_pixel2": 401.0,
      "confidence": 0.8889867841409691,
      "detection_id": 8,
      "integrated_residual_8bit_pixel": 24803.0,
      "mean_intensity_8bit": 110.2793017456359,
      "peak_intensity_8bit": 222.0,
      "peak_residual_intensity_8bit": 171.0,
      "quality_flags": [],
      "x": 235.0,
      "y": 197.0
    },
    {
      "area_pixel2": 401.0,
      "confidence": 0.8889867841409691,
      "detection_id": 9,
      "integrated_residual_8bit_pixel": 24803.0,
      "mean_intensity_8bit": 110.2793017456359,
      "peak_intensity_8bit": 222.0,
      "peak_residual_intensity_8bit": 171.0,
      "quality_flags": [],
      "x": 325.0,
      "y": 197.0
    },
    {
      "area_pixel2": 401.0,
      "confidence": 0.8889867841409691,
      "detection_id": 10,
      "integrated_residual_8bit_pixel": 24803.0,
      "mean_intensity_8bit": 110.2793017456359,
      "peak_intensity_8bit": 222.0,
      "peak_residual_intensity_8bit": 171.0,
      "quality_flags": [],
      "x": 415.0,
      "y": 197.0
    },
    {
      "area_pixel2": 401.0,
      "confidence": 0.8889867841409691,
      "detection_id": 11,
      "integrated_residual_8bit_pixel": 24803.0,
      "mean_intensity_8bit": 110.2793017456359,
      "peak_intensity_8bit": 222.0,
      "peak_residual_intensity_8bit": 171.0,
      "quality_flags": [],
      "x": 505.0,
      "y": 197.0
    },
    {
      "area_pixel2": 401.0,
      "confidence": 0.8889867841409691,
      "detection_id": 12,
      "integrated_residual_8bit_pixel": 24803.0,
      "mean_intensity_8bit": 110.2793017456359,
      "peak_intensity_8bit": 222.0,
      "peak_residual_intensity_8bit": 171.0,
      "quality_flags": [],
      "x": 595.0,
      "y": 197.0
    },
    {
      "area_pixel2": 401.0,
      "confidence": 0.8889867841409691,
      "detection_id": 13,
      "integrated_residual_8bit_pixel": 24803.0,
      "mean_intensity_8bit": 110.2793017456359,
      "peak_intensity_8bit": 222.0,
      "peak_residual_intensity_8bit": 171.0,
      "quality_flags": [],
      "x": 685.0,
      "y": 197.0
    },
    {
      "area_pixel2": 401.0,
      "confidence": 0.8889867841409691,
      "detection_id": 14,
      "integrated_residual_8bit_pixel": 24803.0,
      "mean_intensity_8bit": 110.2793017456359,
      "peak_intensity_8bit": 222.0,
      "peak_residual_intensity_8bit": 171.0,
      "quality_flags": [],
      "x": 775.0,
      "y": 197.0
    },
    {
      "area_pixel2": 401.0,
      "confidence": 0.8889867841409691,
      "detection_id": 15,
      "integrated_residual_8bit_pixel": 24803.0,
      "mean_intensity_8bit": 110.2793017456359,
      "peak_intensity_8bit": 222.0,
      "peak_residual_intensity_8bit": 171.0,
      "quality_flags": [],
      "x": 865.0,
      "y": 197.0
    },
    {
      "area_pixel2": 401.0,
      "confidence": 0.8889867841409691,
      "detection_id": 16,
      "integrated_residual_8bit_pixel": 24803.0,
      "mean_intensity_8bit": 110.2793017456359,
      "peak_intensity_8bit": 222.0,
      "peak_residual_intensity_8bit": 171.0,
      "quality_flags": [],
      "x": 955.0,
      "y": 197.0
    },
    {
      "area_pixel2": 401.0,
      "confidence": 0.8889867841409691,
      "detection_id": 17,
      "integrated_residual_8bit_pixel": 24803.0,
      "mean_intensity_8bit": 110.2793017456359,
      "peak_intensity_8bit": 222.0,
      "peak_residual_intensity_8bit": 171.0,
      "quality_flags": [],
      "x": 1045.0,
      "y": 197.0
    },
    {
      "area_pixel2": 401.0,
      "confidence": 0.8889867841409691,
      "detection_id": 18,
      "integrated_residual_8bit_pixel": 24803.0,
      "mean_intensity_8bit": 110.2793017456359,
      "peak_intensity_8bit": 222.0,
      "peak_residual_intensity_8bit": 171.0,
      "quality_flags": [],
      "x": 235.0,
      "y": 287.0
    },
    {
      "area_pixel2": 401.0,
      "confidence": 0.8889867841409691,
      "detection_id": 19,
      "integrated_residual_8bit_pixel": 24803.0,
      "mean_intensity_8bit": 110.2793017456359,
      "peak_intensity_8bit": 222.0,
      "peak_residual_intensity_8bit": 171.0,
      "quality_flags": [],
      "x": 325.0,
      "y": 287.0
    },
    {
      "area_pixel2": 401.0,
      "confidence": 0.8889867841409691,
      "detection_id": 20,
      "integrated_residual_8bit_pixel": 24803.0,
      "mean_intensity_8bit": 110.2793017456359,
      "peak_intensity_8bit": 222.0,
      "peak_residual_intensity_8bit": 171.0,
      "quality_flags": [],
      "x": 415.0,
      "y": 287.0
    },
    {
      "area_pixel2": 401.0,
      "confidence": 0.8889867841409691,
      "detection_id": 21,
      "integrated_residual_8bit_pixel": 24803.0,
      "mean_intensity_8bit": 110.2793017456359,
      "peak_intensity_8bit": 222.0,
      "peak_residual_intensity_8bit": 171.0,
      "quality_flags": [],
      "x": 505.0,
      "y": 287.0
    },
    {
      "area_pixel2": 401.0,
      "confidence": 0.8889867841409691,
      "detection_id": 22,
      "integrated_residual_8bit_pixel": 24803.0,
      "mean_intensity_8bit": 110.2793017456359,
      "peak_intensity_8bit": 222.0,
      "peak_residual_intensity_8bit": 171.0,
      "quality_flags": [],
      "x": 595.0,
      "y": 287.0
    },
    {
      "area_pixel2": 401.0,
      "confidence": 0.8889867841409691,
      "detection_id": 23,
      "integrated_residual_8bit_pixel": 24803.0,
      "mean_intensity_8bit": 110.2793017456359,
      "peak_intensity_8bit": 222.0,
      "peak_residual_intensity_8bit": 171.0,
      "quality_flags": [],
      "x": 685.0,
      "y": 287.0
    },
    {
      "area_pixel2": 401.0,
      "confidence": 0.8889867841409691,
      "detection_id": 24,
      "integrated_residual_8bit_pixel": 24803.0,
      "mean_intensity_8bit": 110.2793017456359,
      "peak_intensity_8bit": 222.0,
      "peak_residual_intensity_8bit": 171.0,
      "quality_flags": [],
      "x": 775.0,
      "y": 287.0
    },
    {
      "area_pixel2": 401.0,
      "confidence": 0.8889867841409691,
      "detection_id": 25,
      "integrated_residual_8bit_pixel": 24803.0,
      "mean_intensity_8bit": 110.2793017456359,
      "peak_intensity_8bit": 222.0,
      "peak_residual_intensity_8bit": 171.0,
      "quality_flags": [],
      "x": 865.0,
      "y": 287.0
    },
    {
      "area_pixel2": 401.0,
      "confidence": 0.8889867841409691,
      "detection_id": 26,
      "integrated_residual_8bit_pixel": 24803.0,